{
  "$schema": "http://json-schema.org/draft-07/schema#",
  "$id": "https://siq.dev/contracts/local-raw-task-content-record-content.v1.schema.json",
  "title": "Explicit decrypted raw task content response",
  "type": "object",
  "additionalProperties": false,
  "required": ["schema_version", "contains_plaintext", "record", "fields"],
  "properties": {
    "schema_version": { "const": "local-raw-task-content-record-content/v1" },
    "contains_plaintext": { "const": true },
    "record": { "$ref": "https://siq.dev/contracts/local-raw-task-content-record.v1.schema.json" },
    "fields": {
      "type": "array",
      "minItems": 1,
      "maxItems": 1024,
      "items": {
        "type": "object",
        "additionalProperties": false,
        "required": ["path", "value"],
        "properties": {
          "path": { "type": "string", "minLength": 1, "maxLength": 256 },
          "value": { "type": "string", "minLength": 1, "maxLength": 1048576 }
        }
      }
    }
  }
}
