{
  "schema_version": "local-raw-task-content-record-content/v1",
  "contains_plaintext": true,
  "record": {
    "schema_version": "local-raw-task-content-record/v1",
    "status": "active",
    "record_id": "raw-cccccccccccccccccccccccccccccccc",
    "task_ref": "sha256:ecc98de3925e6b929a78e54fb5741c83e0059efd34411f768c795c4659186ebe",
    "kind": "input",
    "created_at": "2026-09-13T13:00:05Z",
    "expires_at": "2026-09-13T14:00:05Z",
    "plaintext_sha256": "dddddddddddddddddddddddddddddddddddddddddddddddddddddddddddddddd",
    "plaintext_bytes": 96,
    "omitted_secret_count": 0
  },
  "fields": [
    {
      "path": "/prompt",
      "value": "fixture prompt"
    }
  ]
}
